{
  "extractor": "html-anchors-v1",
  "final_url": "https://sector035.nl/articles",
  "response_digest": "sha256:a0040d4b34457b249625f8d9098f15bf52a46c740c1b730ae09e846683188f63",
  "schema": "r4b1t-source-link-index-v1",
  "selection_authority": false,
  "source_url": "https://sector035.nl/articles",
  "urls": [
    "https://medium.com/@week-in-osint",
    "https://sector035.nl/",
    "https://sector035.nl/articles.atom",
    "https://sector035.nl/articles.rss",
    "https://sector035.nl/articles/2024-25",
    "https://sector035.nl/articles/2024-26",
    "https://sector035.nl/articles/2024-27",
    "https://sector035.nl/articles/2024-29",
    "https://sector035.nl/articles/2024-30",
    "https://sector035.nl/articles/2024-31",
    "https://sector035.nl/articles/archives_month:apr_2024",
    "https://sector035.nl/articles/archives_month:aug_2024",
    "https://sector035.nl/articles/archives_month:dec_2023",
    "https://sector035.nl/articles/archives_month:dec_2024",
    "https://sector035.nl/articles/archives_month:feb_2024",
    "https://sector035.nl/articles/archives_month:jan_2024",
    "https://sector035.nl/articles/archives_month:jul_2024",
    "https://sector035.nl/articles/archives_month:jun_2024",
    "https://sector035.nl/articles/archives_month:mar_2024",
    "https://sector035.nl/articles/archives_month:may_2024",
    "https://sector035.nl/articles/archives_month:nov_2023",
    "https://sector035.nl/articles/archives_month:oct_2024",
    "https://sector035.nl/articles/blackbox-osint",
    "https://sector035.nl/articles/category:article",
    "https://sector035.nl/articles/category:week-in-osint",
    "https://sector035.nl/articles/lake-constance",
    "https://sector035.nl/articles/page:2",
    "https://sector035.nl/articles/page:3",
    "https://sector035.nl/articles/tag:aerial imagery",
    "https://sector035.nl/articles/tag:ai",
    "https://sector035.nl/articles/tag:archive",
    "https://sector035.nl/articles/tag:book",
    "https://sector035.nl/articles/tag:bookmarklet",
    "https://sector035.nl/articles/tag:bookmarks",
    "https://sector035.nl/articles/tag:cryptocurrency",
    "https://sector035.nl/articles/tag:domains",
    "https://sector035.nl/articles/tag:extension",
    "https://sector035.nl/articles/tag:extremism",
    "https://sector035.nl/articles/tag:geolocation",
    "https://sector035.nl/articles/tag:health",
    "https://sector035.nl/articles/tag:maps",
    "https://sector035.nl/articles/tag:methodology",
    "https://sector035.nl/articles/tag:opsec",
    "https://sector035.nl/articles/tag:osint",
    "https://sector035.nl/articles/tag:osm",
    "https://sector035.nl/articles/tag:overpass turbo",
    "https://sector035.nl/articles/tag:phone numbers",
    "https://sector035.nl/articles/tag:podcast",
    "https://sector035.nl/articles/tag:privacy",
    "https://sector035.nl/articles/tag:quiztime",
    "https://sector035.nl/articles/tag:search engine",
    "https://sector035.nl/articles/tag:tool",
    "https://sector035.nl/articles/tag:training",
    "https://sector035.nl/articles/tag:twitter",
    "https://sector035.nl/articles/tag:whois",
    "https://sector035.nl/search"
  ]
}
