{
  "extractor": "html-anchors-v1",
  "final_url": "https://lcamtuf.coredump.cx/",
  "response_digest": "sha256:4b22e1975c67f2f7284857883e40cea0c269d56a4893f8dd6307a0dfeb3afb4b",
  "schema": "r4b1t-source-link-index-v1",
  "selection_authority": false,
  "source_url": "https://lcamtuf.coredump.cx/",
  "urls": [
    "https://blog.coredump.cx/archive",
    "https://blog.coredump.cx/p/a-brief-history-of-counting-stuff",
    "https://blog.coredump.cx/p/algorithms-and-math-trivia",
    "https://blog.coredump.cx/p/electronics-curriculum",
    "https://blog.coredump.cx/subscribe",
    "https://cloud.google.com/security-command-center/docs/concepts-web-security-scanner-overview",
    "https://code.google.com/p/ratproxy/",
    "https://code.google.com/p/skipfish/",
    "https://infosec.exchange/@lcamtuf",
    "https://lcamtuf.blogspot.com/",
    "https://lcamtuf.coredump.cx/25d/",
    "https://lcamtuf.coredump.cx/afl/",
    "https://lcamtuf.coredump.cx/bob-the-cat",
    "https://lcamtuf.coredump.cx/communism/",
    "https://lcamtuf.coredump.cx/css_calc/",
    "https://lcamtuf.coredump.cx/electronics/",
    "https://lcamtuf.coredump.cx/electronics/index-old.shtml",
    "https://lcamtuf.coredump.cx/evilfinder/",
    "https://lcamtuf.coredump.cx/gcnc/",
    "https://lcamtuf.coredump.cx/geiger/",
    "https://lcamtuf.coredump.cx/hyper/",
    "https://lcamtuf.coredump.cx/ipfrag.txt",
    "https://lcamtuf.coredump.cx/leaders/",
    "https://lcamtuf.coredump.cx/mushrooms/",
    "https://lcamtuf.coredump.cx/naer/",
    "https://lcamtuf.coredump.cx/newtcp/",
    "https://lcamtuf.coredump.cx/offsite.shtml",
    "https://lcamtuf.coredump.cx/oldtcp/tcpseq.html",
    "https://lcamtuf.coredump.cx/omni2/",
    "https://lcamtuf.coredump.cx/p0f3/",
    "https://lcamtuf.coredump.cx/peano/",
    "https://lcamtuf.coredump.cx/photo/current/",
    "https://lcamtuf.coredump.cx/photo_basics/",
    "https://lcamtuf.coredump.cx/photo_basics/de.shtml",
    "https://lcamtuf.coredump.cx/plasma_globe/",
    "https://lcamtuf.coredump.cx/postxss/",
    "https://lcamtuf.coredump.cx/prep/",
    "https://lcamtuf.coredump.cx/prep/handheld.html",
    "https://lcamtuf.coredump.cx/prep/index-old.shtml",
    "https://lcamtuf.coredump.cx/rstory/",
    "https://lcamtuf.coredump.cx/signals.txt",
    "https://lcamtuf.coredump.cx/silence/",
    "https://lcamtuf.coredump.cx/sir-box-a-lot",
    "https://lcamtuf.coredump.cx/soft/ld-expl",
    "https://lcamtuf.coredump.cx/soft/memfetch.tgz",
    "https://lcamtuf.coredump.cx/tangled/",
    "https://lcamtuf.coredump.cx/tmp_paper.txt",
    "https://lcamtuf.coredump.cx/ultimate/",
    "https://lcamtuf.coredump.cx/water/",
    "https://lcamtuf.coredump.cx/webring.shtml",
    "https://lcamtuf.coredump.cx/woodworking/",
    "https://lcamtuf.coredump.cx/word/",
    "https://twitter.com/lcamtuf",
    "https://www.chromium.org/Home/chromium-security/client-identification-mechanisms/",
    "https://www.theregister.com/2018/08/10/pwnie_awards/"
  ]
}
