{
  "extractor": "sitemap-urls-v1",
  "final_url": "https://thedfirreport.com/post-sitemap.xml",
  "response_digest": "sha256:b55cf06ede6202845ccb47e38d969e97687a9fb1031ba615a1760ea2a5883f48",
  "schema": "r4b1t-source-link-index-v1",
  "selection_authority": false,
  "source_url": "https://thedfirreport.com/wp-sitemap-posts-post-1.xml",
  "urls": [
    "https://thedfirreport.com/2020/04/04/gogoogle-ransomware/",
    "https://thedfirreport.com/2020/04/14/dharma-ransomware/",
    "https://thedfirreport.com/2020/04/20/sqlserver-or-the-miner-in-the-basement/",
    "https://thedfirreport.com/2020/04/24/ursnif-via-lolbins/",
    "https://thedfirreport.com/2020/04/30/tricky-pyxie/",
    "https://thedfirreport.com/2020/05/08/adfind-recon/",
    "https://thedfirreport.com/2020/06/10/lockbit-ransomware-why-you-no-spread/",
    "https://thedfirreport.com/2020/06/16/the-little-ransomware-that-couldnt-dharma/",
    "https://thedfirreport.com/2020/06/21/snatch-ransomware/",
    "https://thedfirreport.com/2020/07/13/ransomware-again-but-we-changed-the-rdp-port/",
    "https://thedfirreport.com/2020/08/03/dridex-from-word-to-domain-dominance/",
    "https://thedfirreport.com/2020/08/31/netwalker-ransomware-in-1-hour/",
    "https://thedfirreport.com/2020/10/08/ryuks-return/",
    "https://thedfirreport.com/2020/10/18/ryuk-in-5-hours/",
    "https://thedfirreport.com/2020/11/05/ryuk-speed-run-2-hours-to-ransom/",
    "https://thedfirreport.com/2020/11/12/cryptominers-exploiting-weblogic-rce-cve-2020-14882/",
    "https://thedfirreport.com/2020/11/23/pysa-mespinoza-ransomware/",
    "https://thedfirreport.com/2020/12/13/defender-control/",
    "https://thedfirreport.com/2021/01/11/trickbot-still-alive-and-well/",
    "https://thedfirreport.com/2021/01/18/all-that-for-a-coinminer/",
    "https://thedfirreport.com/2021/01/31/bazar-no-ryuk/",
    "https://thedfirreport.com/2021/02/28/laravel-debug-leaking-secrets/",
    "https://thedfirreport.com/2021/03/08/bazar-drops-the-anchor/",
    "https://thedfirreport.com/2021/03/29/sodinokibi-aka-revil-ransomware/",
    "https://thedfirreport.com/2021/05/02/trickbot-brief-creds-and-beacons/",
    "https://thedfirreport.com/2021/05/12/conti-ransomware/",
    "https://thedfirreport.com/2021/06/03/weblogic-rce-leads-to-xmrig/",
    "https://thedfirreport.com/2021/06/20/from-word-to-lateral-movement-in-1-hour/",
    "https://thedfirreport.com/2021/06/28/hancitor-continues-to-push-cobalt-strike/",
    "https://thedfirreport.com/2021/07/19/icedid-and-cobalt-strike-vs-antivirus/",
    "https://thedfirreport.com/2021/08/01/bazarcall-to-conti-ransomware-via-trickbot-and-cobalt-strike/",
    "https://thedfirreport.com/2021/08/16/trickbot-leads-up-to-fake-1password-installation/",
    "https://thedfirreport.com/2021/08/29/cobalt-strike-a-defenders-guide/",
    "https://thedfirreport.com/2021/09/13/bazarloader-to-conti-ransomware-in-32-hours/",
    "https://thedfirreport.com/2021/10/04/bazarloader-and-the-conti-leaks/",
    "https://thedfirreport.com/2021/10/18/icedid-to-xinglocker-ransomware-in-24-hours/",
    "https://thedfirreport.com/2021/11/01/from-zero-to-domain-admin/",
    "https://thedfirreport.com/2021/11/15/exchange-exploit-leads-to-domain-wide-ransomware/",
    "https://thedfirreport.com/2021/11/29/continuing-the-bazar-ransomware-story/",
    "https://thedfirreport.com/2021/12/13/diavol-ransomware/",
    "https://thedfirreport.com/2022/01/24/cobalt-strike-a-defenders-guide-part-2/",
    "https://thedfirreport.com/2022/02/07/qbot-likes-to-move-it-move-it/",
    "https://thedfirreport.com/2022/02/21/qbot-and-zerologon-lead-to-full-domain-compromise/",
    "https://thedfirreport.com/2022/03/07/2021-year-in-review/",
    "https://thedfirreport.com/2022/03/21/phosphorus-automates-initial-access-using-proxyshell/",
    "https://thedfirreport.com/2022/04/04/stolen-images-campaign-ends-in-conti-ransomware/",
    "https://thedfirreport.com/2022/04/25/quantum-ransomware/",
    "https://thedfirreport.com/2022/05/09/seo-poisoning-a-gootloader-story/",
    "https://thedfirreport.com/2022/06/06/will-the-real-msiexec-please-stand-up-exploit-leads-to-data-exfiltration/",
    "https://thedfirreport.com/2022/06/16/sans-ransomware-summit-2022-can-you-detect-this/",
    "https://thedfirreport.com/2022/07/11/select-xmrig-from-sqlserver/",
    "https://thedfirreport.com/2022/08/08/bumblebee-roasts-its-way-to-domain-admin/",
    "https://thedfirreport.com/2022/09/12/dead-or-alive-an-emotet-story/",
    "https://thedfirreport.com/2022/09/26/bumblebee-round-two/",
    "https://thedfirreport.com/2022/10/31/follina-exploit-leads-to-domain-compromise/",
    "https://thedfirreport.com/2022/11/14/bumblebee-zeros-in-on-meterpreter/",
    "https://thedfirreport.com/2022/11/28/emotet-strikes-again-lnk-file-leads-to-domain-wide-ransomware/",
    "https://thedfirreport.com/2023/01/09/unwrapping-ursnifs-gifts/",
    "https://thedfirreport.com/2023/01/23/sharefinder-how-threat-actors-discover-file-shares/",
    "https://thedfirreport.com/2023/02/06/collect-exfiltrate-sleep-repeat/",
    "https://thedfirreport.com/2023/03/06/2022-year-in-review/",
    "https://thedfirreport.com/2023/03/16/default-post/",
    "https://thedfirreport.com/2023/04/03/malicious-iso-file-leads-to-domain-wide-ransomware/",
    "https://thedfirreport.com/2023/05/22/icedid-macro-ends-in-nokoyawa-ransomware/",
    "https://thedfirreport.com/2023/06/12/a-truly-graceful-wipe-out/",
    "https://thedfirreport.com/2023/08/28/html-smuggling-leads-to-domain-wide-ransomware/",
    "https://thedfirreport.com/2023/09/25/from-screenconnect-to-hive-ransomware-in-61-hours/",
    "https://thedfirreport.com/2023/10/30/netsupport-intrusion-results-in-domain-compromise/",
    "https://thedfirreport.com/2023/12/04/sql-brute-force-leads-to-bluesky-ransomware/",
    "https://thedfirreport.com/2023/12/18/lets-opendir-some-presents-an-analysis-of-a-persistent-actors-activity/",
    "https://thedfirreport.com/2024/01/29/buzzing-on-christmas-eve-trigona-ransomware-in-3-hours/",
    "https://thedfirreport.com/2024/02/26/seo-poisoning-to-domain-control-the-gootloader-saga-continues/",
    "https://thedfirreport.com/2024/03/04/threat-brief-wordpress-exploit-leads-to-godzilla-web-shell-discovery-new-cve/",
    "https://thedfirreport.com/2024/04/01/from-onenote-to-ransomnote-an-ice-cold-intrusion/",
    "https://thedfirreport.com/2024/04/29/from-icedid-to-dagon-locker-ransomware-in-29-days/",
    "https://thedfirreport.com/2024/06/10/icedid-brings-screenconnect-and-csharp-streamer-to-alphv-ransomware-deployment/",
    "https://thedfirreport.com/2024/08/12/threat-actors-toolkit-leveraging-sliver-poshc2-batch-scripts/",
    "https://thedfirreport.com/2024/08/26/blacksuit-ransomware/",
    "https://thedfirreport.com/2024/09/30/nitrogen-campaign-drops-sliver-and-ends-with-blackcat-ransomware/",
    "https://thedfirreport.com/2024/10/28/inside-the-open-directory-of-the-you-dun-threat-group/",
    "https://thedfirreport.com/2024/12/02/the-curious-case-of-an-egg-cellent-resume/",
    "https://thedfirreport.com/2025/01/27/cobalt-strike-and-a-pair-of-socks-lead-to-lockbit-ransomware/",
    "https://thedfirreport.com/2025/02/24/confluence-exploit-leads-to-lockbit-ransomware/",
    "https://thedfirreport.com/2025/03/31/fake-zoom-ends-in-blacksuit-ransomware/",
    "https://thedfirreport.com/2025/04/28/navigating-through-the-fog/",
    "https://thedfirreport.com/2025/05/19/another-confluence-bites-the-dust-falling-to-elpaco-team-ransomware/",
    "https://thedfirreport.com/2025/06/30/hide-your-rdp-password-spray-leads-to-ransomhub-deployment/",
    "https://thedfirreport.com/2025/07/14/kongtuke-filefix-leads-to-new-interlock-rat-variant/",
    "https://thedfirreport.com/2025/08/05/from-bing-search-to-ransomware-bumblebee-and-adaptixc2-deliver-akira-2/",
    "https://thedfirreport.com/2025/09/08/blurring-the-lines-intrusion-shows-connection-with-three-major-ransomware-gangs/",
    "https://thedfirreport.com/2025/09/29/from-a-single-click-how-lunar-spider-enabled-a-near-two-month-intrusion/",
    "https://thedfirreport.com/2025/12/17/cats-got-your-files-lynx-ransomware/",
    "https://thedfirreport.com/2026/02/23/apache-activemq-exploit-leads-to-lockbit-ransomware/",
    "https://thedfirreport.com/2026/04/22/bissa-scanner-exposed-ai-assisted-mass-exploitation-and-credential-harvesting/",
    "https://thedfirreport.com/2026/05/11/flash-alert-etherrat-and-tuktuk-c2-end-in-the-gentleman-ransomware/",
    "https://thedfirreport.com/2026/06/29/from-bing-search-to-ransomware-bumblebee-and-adaptixc2-deliver-akira-3/",
    "https://thedfirreport.com/2026/08/24/bengalseo-part-1-anatomy-of-the-operation/"
  ]
}
