{
  "extractor": "html-anchors-v1",
  "final_url": "https://cs-people.bu.edu/tromer/",
  "response_digest": "sha256:a04d98ba15be8ab78393146d8afaf8fd04b3c4e3812df8c3ce57fc0176a740b8",
  "schema": "r4b1t-source-link-index-v1",
  "selection_authority": false,
  "source_url": "https://www.cs.tau.ac.il/~tromer/",
  "urls": [
    "http://bu.edu/cs",
    "http://scipr-lab.org",
    "http://zerocash-project.org",
    "https://beautyburst.github.io",
    "https://cs-people.bu.edu/tromer/",
    "https://cs-people.bu.edu/tromer/acoustic",
    "https://cs-people.bu.edu/tromer/cloudsec/",
    "https://cs-people.bu.edu/tromer/cryptodev",
    "https://cs-people.bu.edu/tromer/handsoff",
    "https://cs-people.bu.edu/tromer/join",
    "https://cs-people.bu.edu/tromer/leisec",
    "https://cs-people.bu.edu/tromer/miscellaneous",
    "https://cs-people.bu.edu/tromer/papers/cache-joc-20090619.pdf",
    "https://cs-people.bu.edu/tromer/publications",
    "https://cs-people.bu.edu/tromer/publications#blockchain",
    "https://cs-people.bu.edu/tromer/publications#ml",
    "https://cs-people.bu.edu/tromer/publications#resfhe",
    "https://cs-people.bu.edu/tromer/publications#sca",
    "https://cs-people.bu.edu/tromer/publications#zkp",
    "https://cs-people.bu.edu/tromer/scipr-lab",
    "https://cs-people.bu.edu/tromer/teaching",
    "https://goo.gl/maps/dNmC4Gb4D7XSUhJP8",
    "https://sealance.io",
    "https://www.bu.edu/",
    "https://www.bu.edu/cs/",
    "https://www.bu.edu/questrom/",
    "https://z.cash",
    "https://zkproof.org"
  ]
}
