{
  "extractor": "html-anchors-v1",
  "final_url": "https://tmpout.sh/3/",
  "response_digest": "sha256:f9af8e8a75e844701d157b36644dd2a28550c5034b78fe627ca2b93519285255",
  "schema": "r4b1t-source-link-index-v1",
  "selection_authority": false,
  "source_url": "https://tmpout.sh/3/",
  "urls": [
    "https://tmpout.sh/3/01.html",
    "https://tmpout.sh/3/02.html",
    "https://tmpout.sh/3/03.html",
    "https://tmpout.sh/3/04.html",
    "https://tmpout.sh/3/06.html",
    "https://tmpout.sh/3/07.html",
    "https://tmpout.sh/3/08.html",
    "https://tmpout.sh/3/09.html",
    "https://tmpout.sh/3/10.html",
    "https://tmpout.sh/3/12.html",
    "https://tmpout.sh/3/13.html",
    "https://tmpout.sh/3/14.html",
    "https://tmpout.sh/3/15.test-1.c",
    "https://tmpout.sh/3/16.html",
    "https://tmpout.sh/3/19.html",
    "https://tmpout.sh/3/20.html",
    "https://tmpout.sh/3/21.html",
    "https://tmpout.sh/3/22.html",
    "https://tmpout.sh/3/23.html",
    "https://tmpout.sh/3/24.html",
    "https://tmpout.sh/3/25.html",
    "https://tmpout.sh/3/26.html",
    "https://tmpout.sh/3/27.html",
    "https://tmpout.sh/3/28.html",
    "https://tmpout.sh/3/29.html",
    "https://tmpout.sh/3/30.html",
    "https://tmpout.sh/3/Linux.Anansi.c",
    "https://tmpout.sh/3/Linux.ElizaCanFix.asm",
    "https://tmpout.sh/3/Linux.Slinger.asm",
    "https://tmpout.sh/3/isra_exec_elf64.pl"
  ]
}
