{
  "extractor": "html-anchors-v1",
  "final_url": "https://www.malware-traffic-analysis.net/2026/index.html",
  "response_digest": "sha256:12f7d418503acd2e683946a1fe0ec10632b4780909635afb44cf919c5f958d63",
  "schema": "r4b1t-source-link-index-v1",
  "selection_authority": false,
  "source_url": "https://www.malware-traffic-analysis.net/2026/index.html",
  "urls": [
    "https://www.malware-traffic-analysis.net/2013/index.html",
    "https://www.malware-traffic-analysis.net/2014/index.html",
    "https://www.malware-traffic-analysis.net/2015/index.html",
    "https://www.malware-traffic-analysis.net/2016/index.html",
    "https://www.malware-traffic-analysis.net/2017/index.html",
    "https://www.malware-traffic-analysis.net/2018/index.html",
    "https://www.malware-traffic-analysis.net/2019/index.html",
    "https://www.malware-traffic-analysis.net/2020/index.html",
    "https://www.malware-traffic-analysis.net/2021/index.html",
    "https://www.malware-traffic-analysis.net/2022/index.html",
    "https://www.malware-traffic-analysis.net/2023/index.html",
    "https://www.malware-traffic-analysis.net/2024/index.html",
    "https://www.malware-traffic-analysis.net/2025/index.html",
    "https://www.malware-traffic-analysis.net/2026/01/08/index.html",
    "https://www.malware-traffic-analysis.net/2026/01/09/index.html",
    "https://www.malware-traffic-analysis.net/2026/01/10/index.html",
    "https://www.malware-traffic-analysis.net/2026/01/14/index.html",
    "https://www.malware-traffic-analysis.net/2026/01/15/index.html",
    "https://www.malware-traffic-analysis.net/2026/01/19/index.html",
    "https://www.malware-traffic-analysis.net/2026/01/20/index.html",
    "https://www.malware-traffic-analysis.net/2026/01/20/index2.html",
    "https://www.malware-traffic-analysis.net/2026/01/20/index3.html",
    "https://www.malware-traffic-analysis.net/2026/01/22/index.html",
    "https://www.malware-traffic-analysis.net/2026/01/29/index.html",
    "https://www.malware-traffic-analysis.net/2026/01/30/index.html",
    "https://www.malware-traffic-analysis.net/2026/02/01/index.html",
    "https://www.malware-traffic-analysis.net/2026/02/02/index.html",
    "https://www.malware-traffic-analysis.net/2026/02/03/index.html",
    "https://www.malware-traffic-analysis.net/2026/03/12/index.html",
    "https://www.malware-traffic-analysis.net/2026/03/17/index.html",
    "https://www.malware-traffic-analysis.net/2026/04/06/index.html",
    "https://www.malware-traffic-analysis.net/2026/04/13/index.html",
    "https://www.malware-traffic-analysis.net/2026/04/16/index.html",
    "https://www.malware-traffic-analysis.net/2026/04/22/index.html",
    "https://www.malware-traffic-analysis.net/2026/04/23/index.html",
    "https://www.malware-traffic-analysis.net/2026/05/08/index.html",
    "https://www.malware-traffic-analysis.net/2026/05/11/index.html",
    "https://www.malware-traffic-analysis.net/2026/05/22/index.html",
    "https://www.malware-traffic-analysis.net/2026/05/27/index.html",
    "https://www.malware-traffic-analysis.net/2026/05/31/index.html",
    "https://www.malware-traffic-analysis.net/2026/06/01/index.html",
    "https://www.malware-traffic-analysis.net/2026/06/09/index.html",
    "https://www.malware-traffic-analysis.net/2026/06/18/index.html",
    "https://www.malware-traffic-analysis.net/2026/06/22/index.html",
    "https://www.malware-traffic-analysis.net/2026/07/31/index.html",
    "https://www.malware-traffic-analysis.net/2026/07/31/index2.html",
    "https://www.malware-traffic-analysis.net/2026/08/06/index.html",
    "https://www.malware-traffic-analysis.net/2026/08/07/index.html",
    "https://www.malware-traffic-analysis.net/2026/08/10/index.html",
    "https://www.malware-traffic-analysis.net/2026/08/12/index.html",
    "https://www.malware-traffic-analysis.net/2026/08/21/index.html",
    "https://www.malware-traffic-analysis.net/2026/08/31/index.html",
    "https://www.malware-traffic-analysis.net/2026/09/01/index.html",
    "https://www.malware-traffic-analysis.net/2026/09/08/index.html",
    "https://www.malware-traffic-analysis.net/2026/09/10/index.html",
    "https://www.malware-traffic-analysis.net/2026/09/14/index.html",
    "https://www.malware-traffic-analysis.net/2026/09/15/index.html",
    "https://www.malware-traffic-analysis.net/2026/09/17/index.html",
    "https://www.malware-traffic-analysis.net/2026/09/24/index.html",
    "https://www.malware-traffic-analysis.net/index.html"
  ]
}
