{
  "extractor": "html-anchors-v1",
  "final_url": "https://priyom.org/number-stations/digital",
  "response_digest": "sha256:b4ab3ca7b65c12ba4fee4629d9b44a1b2ea7d120a5edbc26cafd1f36583c5cd2",
  "schema": "r4b1t-source-link-index-v1",
  "selection_authority": false,
  "source_url": "https://priyom.org/number-stations/digital",
  "urls": [
    "https://creativecommons.org/licenses/by-nc-sa/4.0/",
    "https://github.com/priyom",
    "https://priyom.org/",
    "https://priyom.org/about",
    "https://priyom.org/blog",
    "https://priyom.org/diplomatic-stations",
    "https://priyom.org/military-stations",
    "https://priyom.org/number-stations",
    "https://priyom.org/number-stations/digital",
    "https://priyom.org/number-stations/digital/f01",
    "https://priyom.org/number-stations/digital/f06",
    "https://priyom.org/number-stations/digital/f06a",
    "https://priyom.org/number-stations/digital/f07",
    "https://priyom.org/number-stations/digital/f11",
    "https://priyom.org/number-stations/digital/hm01",
    "https://priyom.org/number-stations/digital/p07",
    "https://priyom.org/number-stations/digital/sk01",
    "https://priyom.org/number-stations/digital/xp",
    "https://priyom.org/number-stations/digital/xpa",
    "https://priyom.org/number-stations/digital/xpa2",
    "https://priyom.org/number-stations/digital/xpb",
    "https://priyom.org/number-stations/english",
    "https://priyom.org/number-stations/english/e06",
    "https://priyom.org/number-stations/english/e07",
    "https://priyom.org/number-stations/english/e11",
    "https://priyom.org/number-stations/english/e17",
    "https://priyom.org/number-stations/german",
    "https://priyom.org/number-stations/german/g06",
    "https://priyom.org/number-stations/german/g07",
    "https://priyom.org/number-stations/german/g11",
    "https://priyom.org/number-stations/morse",
    "https://priyom.org/number-stations/morse/m03",
    "https://priyom.org/number-stations/morse/m08a",
    "https://priyom.org/number-stations/morse/m12",
    "https://priyom.org/number-stations/morse/m14",
    "https://priyom.org/number-stations/operators",
    "https://priyom.org/number-stations/operators/polish-11/digital-modes",
    "https://priyom.org/number-stations/other",
    "https://priyom.org/number-stations/other/v02a",
    "https://priyom.org/number-stations/other/v06",
    "https://priyom.org/number-stations/other/v07",
    "https://priyom.org/number-stations/other/v07f",
    "https://priyom.org/number-stations/other/v23",
    "https://priyom.org/number-stations/slavic",
    "https://priyom.org/number-stations/slavic/s06",
    "https://priyom.org/number-stations/slavic/s07",
    "https://priyom.org/number-stations/slavic/s11",
    "https://priyom.org/number-stations/slavic/s11a",
    "https://priyom.org/number-stations/station-schedule"
  ]
}
