{
  "extractor": "html-anchors-v1",
  "final_url": "https://tmpout.sh/4/",
  "response_digest": "sha256:e960c2610a0a738cb304e9556f89060a3ac06b5b4a876843e83b73b2c0e46961",
  "schema": "r4b1t-source-link-index-v1",
  "selection_authority": false,
  "source_url": "https://tmpout.sh/4/",
  "urls": [
    "https://bsky.app/profile/tmpout.sh",
    "https://haunted.computer/@tmpout",
    "https://tmpout.sh",
    "https://tmpout.sh/4/1.html",
    "https://tmpout.sh/4/10.html",
    "https://tmpout.sh/4/11.html",
    "https://tmpout.sh/4/12.html",
    "https://tmpout.sh/4/13.html",
    "https://tmpout.sh/4/14.html",
    "https://tmpout.sh/4/15.html",
    "https://tmpout.sh/4/16.html",
    "https://tmpout.sh/4/17.html",
    "https://tmpout.sh/4/18.html",
    "https://tmpout.sh/4/2.html",
    "https://tmpout.sh/4/3.html",
    "https://tmpout.sh/4/4.html",
    "https://tmpout.sh/4/5.html",
    "https://tmpout.sh/4/6.html",
    "https://tmpout.sh/4/7.html",
    "https://tmpout.sh/4/8.html",
    "https://tmpout.sh/4/9.html",
    "https://tmpout.sh/4/art.html",
    "https://x.com/tmpout"
  ]
}
