{
  "extractor": "html-anchors-v1",
  "final_url": "https://greatscottgadgets.com/",
  "response_digest": "sha256:4a604359e85aa08bfd371d86515dc3371cbd07759348bfee29cd1bdb24f7ac05",
  "schema": "r4b1t-source-link-index-v1",
  "selection_authority": false,
  "source_url": "https://greatscottgadgets.com/",
  "urls": [
    "https://arxiv.org/abs/2601.15494",
    "https://bsky.app/profile/greatscottgadgets.bsky.social",
    "https://discord.com/invite/rsfMw3rsU8",
    "https://discord.gg/rsfMw3rsU8",
    "https://github.com/greatscottgadgets",
    "https://greatscottgadgets.com/",
    "https://greatscottgadgets.com/2019/03-15-goodbye-dominic/",
    "https://greatscottgadgets.com/2026/02-19-free-stuff-november-2025/",
    "https://greatscottgadgets.com/2026/02-19-free-stuff-october-2025/",
    "https://greatscottgadgets.com/2026/02-19-free-stuff-september-2025/",
    "https://greatscottgadgets.com/2026/03-15-self-repair-guide-for-hackrf-pro-usb-c-connector/",
    "https://greatscottgadgets.com/2026/03-16-free-stuff-december-2025/",
    "https://greatscottgadgets.com/2026/03-17-free-stuff-january-2026/",
    "https://greatscottgadgets.com/2026/06-17-llms-generate-code-communities-build-projects/",
    "https://greatscottgadgets.com/2026/07-01-free-stuff-april-2026/",
    "https://greatscottgadgets.com/2026/07-01-free-stuff-february-2026/",
    "https://greatscottgadgets.com/2026/07-01-free-stuff-march-2026/",
    "https://greatscottgadgets.com/about/",
    "https://greatscottgadgets.com/ant500/",
    "https://greatscottgadgets.com/ant700/",
    "https://greatscottgadgets.com/contact/",
    "https://greatscottgadgets.com/cynthion/",
    "https://greatscottgadgets.com/daisho/",
    "https://greatscottgadgets.com/feed.xml",
    "https://greatscottgadgets.com/fireflycap/",
    "https://greatscottgadgets.com/freestuff/",
    "https://greatscottgadgets.com/greatfet/",
    "https://greatscottgadgets.com/greatfet/acrylic-case/",
    "https://greatscottgadgets.com/greatfet/daffodil/",
    "https://greatscottgadgets.com/greatfet/one/",
    "https://greatscottgadgets.com/h2hc2013badge/",
    "https://greatscottgadgets.com/hackrf/",
    "https://greatscottgadgets.com/hackrf/acrylic-case/",
    "https://greatscottgadgets.com/hackrf/one",
    "https://greatscottgadgets.com/hackrf/one/",
    "https://greatscottgadgets.com/hackrf/operacake/",
    "https://greatscottgadgets.com/hackrf/pro/",
    "https://greatscottgadgets.com/jobs/",
    "https://greatscottgadgets.com/luna-superspeed/",
    "https://greatscottgadgets.com/opensource/",
    "https://greatscottgadgets.com/page/17/",
    "https://greatscottgadgets.com/page/2/",
    "https://greatscottgadgets.com/page/3/",
    "https://greatscottgadgets.com/page/4/",
    "https://greatscottgadgets.com/page/5/",
    "https://greatscottgadgets.com/pocorgtfo/",
    "https://greatscottgadgets.com/presentations/",
    "https://greatscottgadgets.com/sdr/",
    "https://greatscottgadgets.com/support/",
    "https://greatscottgadgets.com/tags/",
    "https://greatscottgadgets.com/tags/freestuff",
    "https://greatscottgadgets.com/tags/hackrf",
    "https://greatscottgadgets.com/tags/policy",
    "https://greatscottgadgets.com/tc13badge/",
    "https://greatscottgadgets.com/tc14badge/",
    "https://greatscottgadgets.com/throwingstar/",
    "https://greatscottgadgets.com/toorcamp2018badge/",
    "https://greatscottgadgets.com/tr/",
    "https://greatscottgadgets.com/trademarks/",
    "https://greatscottgadgets.com/ubertoothone/",
    "https://greatscottgadgets.com/upcoming-events/",
    "https://greatscottgadgets.com/urti/",
    "https://greatscottgadgets.com/wheretobuy/",
    "https://greatscottgadgets.com/yardstickone",
    "https://greatscottgadgets.com/yardstickone/",
    "https://greatscottgadgets.com/zines/",
    "https://mastodon.social/@GreatScottGadgets",
    "https://www.etsy.com/shop/Haxessories",
    "https://www.instagram.com/greatscottgadgets/",
    "https://www.youtube.com/GreatScottGadgets",
    "https://www.youtube.com/watch?v=zuXJtpTSEJM"
  ]
}
