{
  "extractor": "html-anchors-v1",
  "final_url": "https://sergei.nz/",
  "response_digest": "sha256:8c5a3b6b6dd1f016376747665450424da0216d5c8381c9237611ce0545f57676",
  "schema": "r4b1t-source-link-index-v1",
  "selection_authority": false,
  "source_url": "https://sergei.nz/",
  "urls": [
    "http://www.sergei.nz/",
    "https://developer.android.com/studio/command-line/adb",
    "https://play.google.com/store/apps/details?id=com.google.android.apps.wellbeing",
    "https://sergei.nz/",
    "https://sergei.nz/#content",
    "https://sergei.nz/2020-update-of-the-nvtk_mp42gpx-py-script/",
    "https://sergei.nz/a-peculiar-case-of-i-o-errors-with-cheap-sff-8643-cables/",
    "https://sergei.nz/a-peculiar-case-of-i-o-errors-with-cheap-sff-8643-cables/#comments",
    "https://sergei.nz/a-peculiar-case-of-i-o-errors-with-cheap-sff-8643-cables/#more-1331",
    "https://sergei.nz/approximating-soc-of-a-lithium-ion-battery-using-atan/",
    "https://sergei.nz/approximating-soc-of-a-lithium-ion-battery-using-atan/#more-1317",
    "https://sergei.nz/brother-mfc-9320cw-no-ethernet-link-repair/",
    "https://sergei.nz/category/cameras/",
    "https://sergei.nz/category/cameras/dashcams/",
    "https://sergei.nz/category/cameras/ip-cameras/",
    "https://sergei.nz/category/cars/",
    "https://sergei.nz/category/cars/grb-sti/",
    "https://sergei.nz/category/stuff/",
    "https://sergei.nz/category/stuff/motion-detection/",
    "https://sergei.nz/category/stuff/ripped-off/",
    "https://sergei.nz/category/things/",
    "https://sergei.nz/category/uncategorised/",
    "https://sergei.nz/contact/",
    "https://sergei.nz/converting-dewalt-dcb101-110v-charger-to-240v/",
    "https://sergei.nz/dealing-with-data-obfuscation-in-some-chinese-dash-cameras/",
    "https://sergei.nz/death-and-resurrection-of-asus-rt-n16/",
    "https://sergei.nz/extracting-gps-data-from-viofo-a119-and-other-novatek-powered-cameras/",
    "https://sergei.nz/files/nvtk_mp42gpx.py",
    "https://sergei.nz/high-side-power-switch-for-a-microcontroller/",
    "https://sergei.nz/high-side-power-switch-for-a-microcontroller/#more-1309",
    "https://sergei.nz/idiot/",
    "https://sergei.nz/interfacing-ina219-board-with-micropython/",
    "https://sergei.nz/interfacing-ina219-board-with-micropython/#more-1285",
    "https://sergei.nz/interfacing-pct06-uart-camera-with-micropython/",
    "https://sergei.nz/interfacing-pct06-uart-camera-with-micropython/#more-1291",
    "https://sergei.nz/mitigating-false-positive-triggers-of-a-hc-sr501-pir-sensor-connected-to-an-esp8266/",
    "https://sergei.nz/nvtk_mp42gpx-py-revisited-now-with-ts-support/",
    "https://sergei.nz/nvtk_mp42gpx-py-revisited-now-with-ts-support/#comments",
    "https://sergei.nz/opus-bt-c100-reverse-polarity-protection/",
    "https://sergei.nz/page/2/",
    "https://sergei.nz/page/9/",
    "https://sergei.nz/predatory-practices-of-dash-cam-manufacturers/",
    "https://sergei.nz/remove-googles-digital-wellbeing-spyware-from-android-via-adb/",
    "https://sergei.nz/remove-googles-digital-wellbeing-spyware-from-android-via-adb/#comments",
    "https://sergei.nz/removing-annoying-secure-wifi-from-samung-phones/",
    "https://sergei.nz/scripts-and-other-hacks/",
    "https://sergei.nz/sjg-forester-tracking-down-noisy-wheel-bearings/",
    "https://sergei.nz/stop-google-chrome-from-hijacking-mimes/",
    "https://sergei.nz/tag/adb/",
    "https://sergei.nz/tag/akasocar/",
    "https://sergei.nz/tag/ankeway/",
    "https://sergei.nz/tag/anti-consumer/",
    "https://sergei.nz/tag/donotbuy/",
    "https://sergei.nz/tag/nvtk_mp42gpx-py/",
    "https://sergei.nz/tag/ripoff/",
    "https://sergei.nz/tag/samsung/",
    "https://sergei.nz/tag/securewifi/",
    "https://sergei.nz/unbricking-asus-chromebox-cn60/",
    "https://sergei.nz/viofo-a119-beeping-with-the-format-prompt-after-a-long-downtime/",
    "https://sergei.nz/wp-content/uploads/2021/08/High-Side-Switch.png",
    "https://wordpress.org/",
    "https://www.xda-developers.com/install-adb-windows-macos-linux/"
  ]
}
