{
  "extractor": "html-anchors-v1",
  "final_url": "https://tmpout.sh/2/",
  "response_digest": "sha256:dfecce7bd1bb6dc3e425e4fabe222a95fad923148187f86fd19f049c8fa7ed45",
  "schema": "r4b1t-source-link-index-v1",
  "selection_authority": false,
  "source_url": "https://tmpout.sh/2/",
  "urls": [
    "https://tmpout.sh/2/0.html",
    "https://tmpout.sh/2/1.html",
    "https://tmpout.sh/2/10.html",
    "https://tmpout.sh/2/11.html",
    "https://tmpout.sh/2/12.html",
    "https://tmpout.sh/2/13.html",
    "https://tmpout.sh/2/14.html",
    "https://tmpout.sh/2/15.html",
    "https://tmpout.sh/2/2.html",
    "https://tmpout.sh/2/3.html",
    "https://tmpout.sh/2/4.html",
    "https://tmpout.sh/2/5.html",
    "https://tmpout.sh/2/6.html",
    "https://tmpout.sh/2/7.html",
    "https://tmpout.sh/2/9.html",
    "https://tmpout.sh/2/Lin64.M4rx.asm",
    "https://tmpout.sh/2/tr/"
  ]
}
