{
  "extractor": "html-anchors-v1",
  "final_url": "https://pwn.college/dojos",
  "response_digest": "sha256:df8163c14b8e01d2e148ecec47749398869cad6b1a1b84dd1d0a38e7b63afa97",
  "schema": "r4b1t-source-link-index-v1",
  "selection_authority": false,
  "source_url": "https://pwn.college/dojos",
  "urls": [
    "https://discord.gg/pwncollege",
    "https://llc.pwn.college/",
    "https://pwn.college/",
    "https://pwn.college/belts",
    "https://pwn.college/cdn-cgi/l/email-protection#f282859cb282859cdc919d9e9e979597",
    "https://pwn.college/dojo/academy-ctf-v2~020f0262",
    "https://pwn.college/dojo/acsac-ctfs",
    "https://pwn.college/dojo/advent-of-pwn",
    "https://pwn.college/dojo/adversarial-ml-dojo~3c016843",
    "https://pwn.college/dojo/archive",
    "https://pwn.college/dojo/arm-architecture",
    "https://pwn.college/dojo/aturt13-dojo~4fac9429",
    "https://pwn.college/dojo/az-ctf-2025~6fbdc1d4",
    "https://pwn.college/dojo/codesprouts~a2cb8d41",
    "https://pwn.college/dojo/computing-101",
    "https://pwn.college/dojo/content-injection~24cec712",
    "https://pwn.college/dojo/cryptomania",
    "https://pwn.college/dojo/cse365-2026-summer",
    "https://pwn.college/dojo/cse365-f2026",
    "https://pwn.college/dojo/cse466-f2025",
    "https://pwn.college/dojo/cse466-f2026",
    "https://pwn.college/dojo/cse598-asow-f2026",
    "https://pwn.college/dojo/cse598-avr-f2024",
    "https://pwn.college/dojo/cse598-avr-f2025",
    "https://pwn.college/dojo/cse598-se-s2025",
    "https://pwn.college/dojo/ctf-archive",
    "https://pwn.college/dojo/dc33-dca-dojo~49335f5f",
    "https://pwn.college/dojo/demo-dojo",
    "https://pwn.college/dojo/districtcon~f1b3d7f0",
    "https://pwn.college/dojo/dos-dojo~c41cb03a",
    "https://pwn.college/dojo/dsu-cyber-camp~aad191b4",
    "https://pwn.college/dojo/fluffy~ea96493b",
    "https://pwn.college/dojo/fundamentals",
    "https://pwn.college/dojo/fuzz~c7f7b8c2",
    "https://pwn.college/dojo/gca-ctf~8018193d",
    "https://pwn.college/dojo/hacker-history~43f7181b",
    "https://pwn.college/dojo/hanto-dojo~8c1cc454",
    "https://pwn.college/dojo/honors-dojo~28e0e34e",
    "https://pwn.college/dojo/honors-dojo~9d345510",
    "https://pwn.college/dojo/honors-dojo~ef9ed69f",
    "https://pwn.college/dojo/hydra~792145b7",
    "https://pwn.college/dojo/imattasdojo~894900d9",
    "https://pwn.college/dojo/intro-to-cybersecurity",
    "https://pwn.college/dojo/intro-to-programming-languages",
    "https://pwn.college/dojo/kalevala~64ddc78a",
    "https://pwn.college/dojo/kernel-exercise-collection~433e348b",
    "https://pwn.college/dojo/kitten-dojo~d5c9bdf3",
    "https://pwn.college/dojo/linux-luminarium",
    "https://pwn.college/dojo/linux-lunacy~9b739db1",
    "https://pwn.college/dojo/lord-of-osint~9e1a1da1",
    "https://pwn.college/dojo/m0nst3r-dojo~5b4ffee2",
    "https://pwn.college/dojo/pancake-house~e3289d98",
    "https://pwn.college/dojo/privilege-escalation~6d04fe7a",
    "https://pwn.college/dojo/program-security",
    "https://pwn.college/dojo/pwndamentals~cfe9c1cb",
    "https://pwn.college/dojo/pwntools~9b09c9dc",
    "https://pwn.college/dojo/quarterly-quiz",
    "https://pwn.college/dojo/red-team-dojo~a9fb8d5a",
    "https://pwn.college/dojo/rehosting~fbf8a0a3",
    "https://pwn.college/dojo/reversing-hell",
    "https://pwn.college/dojo/rii-router-dojo~ae00dd3a",
    "https://pwn.college/dojo/robwaz-dojo~289c5b68",
    "https://pwn.college/dojo/shell-lin-do",
    "https://pwn.college/dojo/software-exploitation",
    "https://pwn.college/dojo/system-security",
    "https://pwn.college/dojo/thaw~84f102b7",
    "https://pwn.college/dojo/tyler~93cea8a8",
    "https://pwn.college/dojo/web-security~f98637a0",
    "https://pwn.college/dojo/welcome",
    "https://pwn.college/dojo/westworld~d30d9828",
    "https://pwn.college/dojo/windows-warzone",
    "https://pwn.college/dojo/x86-exploitation~a6fb34db",
    "https://pwn.college/dojo/xnu",
    "https://pwn.college/dojos",
    "https://pwn.college/login?next=/dojos?",
    "https://pwn.college/register",
    "https://pwn.college/sensai",
    "https://pwn.college/workspace"
  ]
}
