{
  "extractor": "html-anchors-v1",
  "final_url": "https://blog.doyensec.com/",
  "response_digest": "sha256:cf3dc397b507d7799e7843d6f8ec09c17b822aae244028a6a704752918bc2189",
  "schema": "r4b1t-source-link-index-v1",
  "selection_authority": false,
  "source_url": "https://blog.doyensec.com/",
  "urls": [
    "https://access.redhat.com/security/cve/cve-2026-31635",
    "https://access.redhat.com/security/vulnerabilities/RHSB-2026-003",
    "https://blog.doyensec.com/",
    "https://blog.doyensec.com/2026/06/17/session-switcher.html",
    "https://blog.doyensec.com/2026/09/10/oneplus-session-takeover.html",
    "https://blog.doyensec.com/2026/09/17/ovs.html",
    "https://blog.doyensec.com/2026/09/24/chrome-ios-policy-bypass.html",
    "https://blog.doyensec.com/atom.xml",
    "https://blog.doyensec.com/index.html",
    "https://blog.doyensec.com/page2",
    "https://blogs.oracle.com/linux/intro-to-folios",
    "https://chromium-review.googlesource.com/c/chromium/src/+/7838361",
    "https://chromium.googlesource.com/ios-chromium-mirror/+/refs/heads/main/ios/chrome/browser/app_launcher/model/app_launcher_tab_helper.mm#132",
    "https://copy.fail/",
    "https://datatracker.ietf.org/doc/html/rfc4106",
    "https://dirtycow.ninja/",
    "https://dirtypipe.cm4all.com/",
    "https://docs.openstack.org/neutron/latest/",
    "https://docs.openvswitch.org/en/latest/intro/what-is-ovs/",
    "https://docs.openvswitch.org/en/latest/topics/datapath/",
    "https://doyensec.com",
    "https://en.wikipedia.org/wiki/IP_Flow_Information_Export",
    "https://en.wikipedia.org/wiki/SFlow",
    "https://github.com/antrea-io/antrea",
    "https://github.com/doyensec/burp-session-switcher",
    "https://github.com/doyensec/burp-session-switcher/blob/main/docs/auto_update_rules.md",
    "https://github.com/doyensec/burp-session-switcher/blob/main/docs/settings.md",
    "https://github.com/doyensec/burp-session-switcher/releases",
    "https://github.com/doyensec/ovs-pagecache-write",
    "https://github.com/ovn-kubernetes/ovn-kubernetes",
    "https://github.com/theori-io/copy-fail-CVE-2026-31431",
    "https://github.com/torvalds/linux/commit/36d5fe6a0007",
    "https://github.com/torvalds/linux/commit/48f6a5356a33dd78e7144ae1faef95ffc990aae0",
    "https://github.com/torvalds/linux/commit/f4c50a4034e6",
    "https://github.com/torvalds/linux/commit/f84eca5817390257cef78013d0112481c503b4a3",
    "https://github.com/v4bel/dirtyfrag",
    "https://issues.chromium.org/issues/476591032",
    "https://libvirt.org/formatnetwork.html",
    "https://lore.kernel.org/linux-cve-announce/2026091107-CVE-2026-89487-fcde@gregkh/",
    "https://lore.kernel.org/linux-cve-announce/2026091145-CVE-2026-80977-aae5@gregkh/",
    "https://lore.kernel.org/linux-cve-announce/2026091610-CVE-2026-90049-a5b4@gregkh/",
    "https://lore.kernel.org/netdev/4B5CCA6E-2C49-4F86-8C4E-E1BE15C16C0A@doyensec.com/T/#t",
    "https://lore.kernel.org/netdev/8063260C-05C9-4997-B9B6-2135063C4858@doyensec.com/",
    "https://nvd.nist.gov/vuln/detail/cve-2026-13795",
    "https://portswigger.net/bappstore⁠",
    "https://sashiko.dev/",
    "https://support.apple.com/guide/shortcuts/use-x-callback-url-apdcd7f20a6f/ios",
    "https://twitter.com/Doyensec",
    "https://twitter.com/doyensec",
    "https://ubuntu.com/blog/fragnesia-linux-vulnerability-fixes-available",
    "https://www.openvswitch.org/",
    "https://www.ovirt.org/"
  ]
}
