{
  "extractor": "html-anchors-v1",
  "final_url": "https://blog.ropnop.com/",
  "response_digest": "sha256:01ec0430120353a41190fc8e27eb813a8ea9305332d7a956f68a76b314ced19e",
  "schema": "r4b1t-source-link-index-v1",
  "selection_authority": false,
  "source_url": "https://blog.ropnop.com/",
  "urls": [
    "https://blog.ropnop.com",
    "https://blog.ropnop.com/",
    "https://blog.ropnop.com/attacking-default-installs-of-helm-on-kubernetes/",
    "https://blog.ropnop.com/blog.ropnop.com",
    "https://blog.ropnop.com/configuring-burp-suite-with-android-nougat/",
    "https://blog.ropnop.com/docker-for-pentesters/",
    "https://blog.ropnop.com/extracting-ssh-private-keys-from-windows-10-ssh-agent/",
    "https://blog.ropnop.com/hosting-clr-in-golang/",
    "https://blog.ropnop.com/index.xml",
    "https://blog.ropnop.com/learning-go-concurrency-from-factorio/",
    "https://blog.ropnop.com/page/2/",
    "https://blog.ropnop.com/proxying-cli-tools/",
    "https://blog.ropnop.com/sans-holiday-hack-2017-writeup/",
    "https://blog.ropnop.com/series",
    "https://blog.ropnop.com/series/sans-holiday-hack-write-ups/",
    "https://blog.ropnop.com/serverless-toolkit-for-pentesters/",
    "https://blog.ropnop.com/storing-tokens-in-browser/",
    "https://blog.ropnop.com/tags",
    "https://blog.ropnop.com/tags/.net/",
    "https://blog.ropnop.com/tags/android/",
    "https://blog.ropnop.com/tags/browser/",
    "https://blog.ropnop.com/tags/burp/",
    "https://blog.ropnop.com/tags/clr/",
    "https://blog.ropnop.com/tags/cookies/",
    "https://blog.ropnop.com/tags/docker/",
    "https://blog.ropnop.com/tags/gke/",
    "https://blog.ropnop.com/tags/go/",
    "https://blog.ropnop.com/tags/golang/",
    "https://blog.ropnop.com/tags/helm/",
    "https://blog.ropnop.com/tags/holidayhack/",
    "https://blog.ropnop.com/tags/impacket/",
    "https://blog.ropnop.com/tags/java/",
    "https://blog.ropnop.com/tags/javascript/",
    "https://blog.ropnop.com/tags/kubernetes/",
    "https://blog.ropnop.com/tags/linux/",
    "https://blog.ropnop.com/tags/node/",
    "https://blog.ropnop.com/tags/nougat/",
    "https://blog.ropnop.com/tags/openssh/",
    "https://blog.ropnop.com/tags/pentest/",
    "https://blog.ropnop.com/tags/powershell/",
    "https://blog.ropnop.com/tags/proxy/",
    "https://blog.ropnop.com/tags/python/",
    "https://blog.ropnop.com/tags/rsa/",
    "https://blog.ropnop.com/tags/sans/",
    "https://blog.ropnop.com/tags/serverless/",
    "https://blog.ropnop.com/tags/smb/",
    "https://blog.ropnop.com/tags/ssh/",
    "https://blog.ropnop.com/tags/tiller/",
    "https://blog.ropnop.com/tags/tokens/",
    "https://blog.ropnop.com/tags/windows/",
    "https://blog.ropnop.com/tags/writeup/",
    "https://blog.ropnop.com/talk",
    "https://github.com/halogenica/beautifulhugo",
    "https://github.com/ropnop",
    "https://gohugo.io",
    "https://twitter.com/ropnop"
  ]
}
