{
  "extractor": "html-anchors-v1",
  "final_url": "https://projectzero.google/",
  "response_digest": "sha256:75704424ea07c735db0dd6d1d5ff85b68dc9116ea5246595df955d8c95b226a9",
  "schema": "r4b1t-source-link-index-v1",
  "selection_authority": false,
  "source_url": "https://projectzero.google/",
  "urls": [
    "https://blogs.windows.com/windowsdeveloper/2025/05/19/enhance-your-application-security-with-administrator-protection/",
    "https://bugs.chromium.org/p/project-zero/issues/detail?id=1086",
    "https://bugs.chromium.org/p/project-zero/issues/detail?id=1091",
    "https://chromium-review.googlesource.com/c/chromium/src/+/6711812",
    "https://en.wikipedia.org/wiki/Shatter_attack",
    "https://git.kernel.org/pub/scm/linux/kernel/git/torvalds/linux.git/commit/?id=32ca245464e1479bfea8592b9db227fdc1641705",
    "https://github.com/R41N3RZUF477/QuickAssist_UAC_Bypass",
    "https://github.com/angea/pocorgtfo/blob/master/contents/articles/13-03.pdf",
    "https://github.com/califio/publications/blob/main/MADBugs/windows-CVE-2026-50343/blog.md",
    "https://googleprojectzero.blogspot.com/2023/09/analyzing-modern-in-wild-android-exploit.html",
    "https://googleprojectzero.blogspot.com/2024/06/driving-forward-in-android-drivers.html",
    "https://googleprojectzero.blogspot.com/2024/12/qualcomm-dsp-driver-unexpectedly-excavating-exploit.html",
    "https://googleprojectzero.blogspot.com/2025/05/breaking-sound-barrier-part-i-fuzzing.html",
    "https://googleprojectzero.github.io/0days-in-the-wild/rca.html",
    "https://learn.microsoft.com/en-us/windows/win32/learnwin32/window-messages",
    "https://learn.microsoft.com/en-us/windows/win32/winauto/getprocesshandlefromhwnd",
    "https://policies.google.com/privacy",
    "https://project-zero.issues.chromium.org/423023990#attachment67577205",
    "https://project-zero.issues.chromium.org/issues/368695689",
    "https://project-zero.issues.chromium.org/issues/372511888",
    "https://project-zero.issues.chromium.org/issues/380081941",
    "https://project-zero.issues.chromium.org/issues/389724938",
    "https://project-zero.issues.chromium.org/issues/406271181",
    "https://project-zero.issues.chromium.org/issues/423023990",
    "https://project-zero.issues.chromium.org/issues/42451599",
    "https://project-zero.issues.chromium.org/issues/428075495",
    "https://project-zero.issues.chromium.org/issues/434208461",
    "https://project-zero.issues.chromium.org/issues/538151139",
    "https://project-zero.issues.chromium.org/savedsearches/7162405",
    "https://projectzero.google/",
    "https://projectzero.google/0day.html",
    "https://projectzero.google/2021/09/fuzzing-closed-source-javascript.html",
    "https://projectzero.google/2021/12/a-deep-dive-into-nso-zero-click.html",
    "https://projectzero.google/2025/05/breaking-sound-barrier-part-i-fuzzing.html",
    "https://projectzero.google/2025/05/breaking-sound-barrier-part-i-fuzzing.html#:~:text=The%20Approach%3A%20Knowledge%2DDriven%20Fuzzing",
    "https://projectzero.google/2025/08/from-chrome-renderer-code-exec-to-kernel.html",
    "https://projectzero.google/2025/09/pointer-leaks-through-pointer-keyed.html",
    "https://projectzero.google/2025/11/defeating-kaslr-by-doing-nothing-at-all.html",
    "https://projectzero.google/2025/12/android-itw-dng.html",
    "https://projectzero.google/2025/12/thinking-outside-the-box.html",
    "https://projectzero.google/2025/12/welcome.html",
    "https://projectzero.google/2025/12/windows-exploitation-techniques.html",
    "https://projectzero.google/2026/01/pixel-0-click-part-1.html",
    "https://projectzero.google/2026/01/pixel-0-click-part-2.html",
    "https://projectzero.google/2026/01/pixel-0-click-part-3.html",
    "https://projectzero.google/2026/01/sound-barrier-2.html",
    "https://projectzero.google/2026/02/gphfh-deep-dive.html",
    "https://projectzero.google/2026/02/windows-administrator-protection.html",
    "https://projectzero.google/2026/03/mutational-grammar-fuzzing.html",
    "https://projectzero.google/2026/05/pixel-10-exploit.html",
    "https://projectzero.google/2026/09/maccconc-race-condition.html",
    "https://projectzero.google/2026/09/windows-dangling-com.html",
    "https://projectzero.google/2026/26/windows-administrator-protection.html",
    "https://projectzero.google/about-pz.html",
    "https://projectzero.google/archive.html",
    "https://projectzero.google/reporting-transparency.html",
    "https://projectzero.google/vulnerability-disclosure-policy.html",
    "https://projectzero.google/working-at-project-zero.html",
    "https://source.android.com/docs/core/media/framework-hardening?authuser=1#mediacodecservice_changes",
    "https://support.apple.com/en-us/122373",
    "https://support.microsoft.com/en-gb/topic/october-28-2025-kb5067036-os-builds-26200-7019-and-26100-7019-preview-ec3da7dc-63ba-4b1d-ac41-cf2494d2123a",
    "https://unit42.paloaltonetworks.com/landfall-is-new-commercial-grade-android-spyware/",
    "https://www.monkeysaudio.com/",
    "https://www.youtube.com/watch?v=U1kc7fcF5Ao"
  ]
}
